{
  "version": "0.1.0",
  "state_dir": "${CODEX_HOME}/1c-ai-core",
  "active_project": null,
  "mcp": {
    "required": {
      "edt": {
        "mode": "user",
        "url": ""
      },
      "v8std": {
        "mode": "user",
        "url": ""
      }
    },
    "managed": {
      "code-index": {
        "mode": "auto",
        "version": "latest",
        "allow_prerelease": false,
        "enabled": true
      },
      "bsl-ls": {
        "mode": "auto",
        "version": "latest",
        "allow_prerelease": false,
        "java": "java",
        "node": "node",
        "configuration": null,
        "enabled": false
      }
    },
    "optional": {
      "openviking": {
        "enabled": false,
        "url": "",
        "timeout_seconds": 20,
        "max_response_bytes": 2097152,
        "headers_env": {}
      }
    }
  }
}
